<?xml version="1.0" encoding="UTF-8"?>

<!ELEMENT employees (employee+)>
<!--+is used to get multiple input-->
<!ELEMENT employee (id,name)>
<!ELEMENT id (#PCDATA)>
<!ELEMENT name (#PCDATA)>
<!ATTLIST employee empid ID #REQUIRED>